{
  "profile_version": "1.0",
  "contract_binding": {"contract_version": "2.0"},
  "object_type": "repair_plan",
  "plan_id": "plan:w3b-a:fixture:001",
  "logical_store_claim": "store:shadow:fixture:001",
  "snapshot_digest": "sha256:1111111111111111111111111111111111111111111111111111111111111111",
  "snapshot_size": 4096,
  "observed_store_version": 100,
  "anomaly_classifications": ["DETERMINISTIC_PLAN_CANDIDATE"],
  "evidence_set_digest": "sha256:6c6906ceafc296e8997170abd5d4f719f10bfabee9e59efee105cbca4f632cec",
  "proposed_diff": [
    {
      "action": "DECLARE_CANONICAL_INDEX_GAP",
      "subject": "idx_audit_events_aggregate",
      "effect": "NONE",
      "rationale": "Declare a canonical index difference without applying a mutation."
    }
  ],
  "expected_invariant_set": [
    "SOURCE_SNAPSHOT_UNCHANGED",
    "NO_STORE_MUTATION",
    "NO_AUTHORITY_EFFECT",
    "NO_EXECUTION_EFFECT",
    "NO_ACTIVATION_EFFECT",
    "PLAN_TERMINATES_AT_VERIFICATION"
  ],
  "created_at": "2026-08-25T10:00:00Z",
  "plan_digest": "sha256:8e464359205cd5d5b9df2786ff5fe4e75e9b670d262458c52eb3b03a541cae7e",
  "plan_state": "PLANNED",
  "shadow_status": "SHADOW_ONLY",
  "execution_eligibility": "EXECUTION_INELIGIBLE",
  "authority_status": "AUTHORITY_NONE",
  "mutation_status": "MUTATION_NONE",
  "governance_status": "UNAUTHENTICATED_SHADOW",
  "authority_effect": "NONE",
  "identity_effect": "NONE",
  "execution_effect": "NONE",
  "activation_effect": "NONE",
  "eligible_for_execution": false,
  "plan_effect": "NONE",
  "mutation_effect": "NONE"
}
